{
  "type": "array",
  "$schema": "http://json-schema.org/draft-07/schema#",
  "items": {
    "type": "object",
    "properties": {
      "id": {
        "type": "string",
        "description": "The slide id"
      },
      "title": {
        "type": "string",
        "description": "Slide title"
      },
      "description": {
        "type": "string",
        "description": "Slide description text"
      },
      "image": {
        "type": "string",
        "description": "Slide image url"
      }
    },
    "required": [
      "id",
      "title",
      "description",
      "image"
    ]
  }
}
